{
  "format": "af-river-map/1",
  "frame": {"rotation": "cw90", "lat": [-18.0, 7.0], "lon": [-80.0, -47.0], "lat0": -5.0},
  "lines": [
    {"id": "amazonas", "kind": "main", "class": 1, "src": "rio_amazonas", "pts": "ehlfQG4DhAAMAjMAiQH7AMAABgB5AEIAWAO3/7YCU/6rAYf/QAGc/nwAfv51AfD94QDb/roBSv1u//f9PQCY/yoDyf7yBWT8MQDP/xcBqv9+AVz/lANFADAD8v58BMH+GQDIAY0E/AE4AW3+JwPH/zUC6P8OBHL/Ngl1/MgCPQErAaH+tAEgAKUBJf8eBPf8IAM1AFMCEP4oAskApgI8ACAGQgPXAj4DYQdlA4wBbQG3BKoBiwRBApYCXv9/APv/EwKSAXIAWgK4/2oEmwF+Asj4yAX0AccDU//MAEgBMQGN+0UDnv8GAMD+c/9lCUYJ9ADHBFgCvAG6AogBVAHUB04CPwXL/p0CVfwFBdr9IQJaAGgAEv6LAIT4LgyKAmgIqAA0A9EAWgEHBJcGJwBaA4UBMwIj/50AhQA8Bfj9GwNQAmECHwA+AukDCQE+AfoJYQRoAH4AlgTBApMDpf/hAAQAAgPz+jcDHQQFBSECkQS1ApoGIQBeAP3/iwU4AcMBLwZ6/7gCVAFPBOwB0QDiALMA2gDjAUoC1wCDAO4DOwJBAIoC", "water": [{"s0": 0.0, "s1": 0.084974, "type": "andean"}, {"s0": 0.084974, "s1": 1.0, "type": "white"}], "splits": [{"id": "encontro", "s0": 0.709076, "s1": 0.722476, "left": "black", "right": "white"}, {"id": "santarem", "s0": 0.855387, "s1": 0.868728, "left": "white", "right": "clear"}]},
    {"id": "para", "kind": "main", "class": 1, "src": "rio_amazonas", "pts": "7qkA3C79Agme/2IMrwLwApEH2//wAu8C", "water": [{"s0": 0.0, "s1": 1.0, "type": "white"}]},
    {"id": "tapajos", "kind": "tributary", "class": 2, "src": "rio_amazonas", "pts": "L22OqSIBEQBFCvQCAwEhAf4DOwL+CdkG9ASGA40ExgMcAboAMwGPAO8JEAM4Aeb/GQHRAQ==", "water": [{"s0": 0.0, "s1": 1.0, "type": "clear"}], "mouth": {"on": "amazonas", "s": 0.855387}, "fill_on_pass": 0.1455},
    {"id": "negro", "kind": "tributary", "class": 2, "src": "rio_amazonas", "pts": "QsxUTRQIKBN5+HkDK/9qAKH4xQGc+CP8dPtlAFH+fAH9/GEFGwCuCk78GxDz/SYAtvtcCMj6QAOo+MADSPuCBZ7/pQHy//sA", "water": [{"s0": 0.0, "s1": 1.0, "type": "black"}], "mouth": {"on": "amazonas", "s": 0.709076}, "fill_on_pass": 0.0634},
    {"id": "casiquiare", "kind": "tributary", "class": 2, "src": "rio_amazonas", "pts": "dNiMbVz0ivY=", "water": [], "mouth": {"on": "negro", "s": 0.243917}, "fill_on_pass": 0.5397},
    {"id": "branco", "kind": "tributary", "class": 2, "src": "rio_amazonas", "pts": "Stdelzb+3/6y/7P/CPys/q/5yv1e9z/+1/o3/bn2Wv809p7/", "water": [{"s0": 0.0, "s1": 1.0, "type": "white"}], "mouth": {"on": "negro", "s": 0.808703}, "fill_on_pass": 0.1898},
    {"id": "takutu", "kind": "tributary", "class": 2, "src": "rio_amazonas", "pts": "XcwonZkOi/9sAK7/SQHv/zL+V/xY/L/+", "water": [], "mouth": {"on": "branco", "s": 0.000761}, "fill_on_pass": 0.3589},
    {"id": "putumayo_ica", "kind": "passby", "class": 2, "src": "rio_amazonas", "pts": "0cPXFqD5UgQW/OYEkf27BD7/rwPW9xMEfvjBBSL7pQIW/p0OH/z9CNX+BAOc/oMFxf43CA==", "water": [{"s0": 0.0, "s1": 1.0, "type": "white"}], "mouth": {"on": "amazonas", "s": 0.502691}, "fill_on_pass": 1.0},
    {"id": "napo", "kind": "tributary", "class": 2, "src": "rio_amazonas", "pts": "ma0CESMAFAHHBWMFa/wYC9n+NwF5/3QB5vGZCLL+MwOp9ZAEcAC3Ag==", "water": [{"s0": 0.0, "s1": 1.0, "type": "white"}], "mouth": {"on": "amazonas", "s": 0.362914}, "fill_on_pass": 0.136},
    {"id": "maranon", "kind": "tributary", "class": 2, "src": "rio_amazonas", "pts": "t06hGVQDGgBZCff9+gqY+rwGj/7kDLr6GgOA/qACKwH5CCADNgLwA6r+vgEz/rgCNf4pBRb+OQbrA6IJaQJAAsr/zgOfAPMA", "water": [{"s0": 0.0, "s1": 1.0, "type": "white"}], "mouth": {"on": "amazonas", "s": 0.329576}, "fill_on_pass": 0.0797},
    {"id": "madre_de_dios", "kind": "tributary", "class": 2, "src": "rio_amazonas", "pts": "WDQGQ1EGUQPc/r4Bu/1bAkMAlAKc/pACHwIPBBX/ZwD4AP0DgwrsCvwECgk=", "water": [{"s0": 0.0, "s1": 1.0, "type": "white"}], "mouth": {"on": "beni", "s": 0.824302}, "fill_on_pass": 0.146},
    {"id": "beni", "kind": "tributary", "class": 2, "src": "rio_amazonas", "pts": "nB2fX+YEHQFeAO3/jgEXAEETTwTyDwgH8AFJANsCWwOWAZsB", "water": [{"s0": 0.0, "s1": 1.0, "type": "white"}], "mouth": {"on": "madeira", "s": 0.0}, "fill_on_pass": 0.1668},
    {"id": "mamore", "kind": "tributary", "class": 2, "src": "rio_amazonas", "pts": "wgPgdEkRXAF2ATkA3gVn/p4FYv96Cor9IBJWAsYChv4XCPT+gQNv/w0BTwA=", "water": [{"s0": 0.0, "s1": 1.0, "type": "white"}], "mouth": {"on": "madeira", "s": 0.0}, "fill_on_pass": 0.1207},
    {"id": "itenez", "kind": "tributary", "class": 2, "src": "rio_amazonas", "pts": "0iJFo9L7Q/hkCqf8OgXZ+oH/3fmRBJr8ZQNb+RcDi/dzAh39VAOc/A==", "water": [{"s0": 0.0, "s1": 1.0, "type": "clear"}], "mouth": {"on": "mamore", "s": 0.786711}, "fill_on_pass": 0.1227},
    {"id": "madeira", "kind": "tributary", "class": 2, "src": "rio_amazonas", "pts": "Ak5WcUYHkP/CBCoIjwTNA00HyQePBRH/8A2YCXEDwgMRBx8HfAcdBh8F4QNRBakC", "water": [{"s0": 0.0, "s1": 1.0, "type": "white"}], "mouth": {"on": "amazonas", "s": 0.737776}, "fill_on_pass": 0.0877},
    {"id": "tocantins", "kind": "passby", "class": 2, "src": "rio_amazonas", "pts": "qCrh9YcSLv59DfIAXAWmAFMGjP8iBq8BvhB6BegHJACZCs7/mwFD82UQsvubD2ABDwWNAg==", "water": [{"s0": 0.0, "s1": 1.0, "type": "clear"}], "mouth": {"on": "para", "s": 0.561048}, "fill_on_pass": 1.0},
    {"id": "xingu", "kind": "passby", "class": 2, "src": "rio_amazonas", "pts": "+DPN0m1AigYgI0b+KRGcAg==", "water": [{"s0": 0.0, "s1": 1.0, "type": "clear"}], "mouth": {"on": "amazonas", "s": 0.925768}, "fill_on_pass": 1.0},
    {"id": "trombetas", "kind": "passby", "class": 2, "src": "rio_amazonas", "pts": "Qq0csvr4HAnS/sgB", "water": [{"s0": 0.0, "s1": 1.0, "type": "clear"}], "mouth": {"on": "amazonas", "s": 0.828639}, "fill_on_pass": 1.0},
    {"id": "purus", "kind": "passby", "class": 2, "src": "rio_amazonas", "pts": "QEq2P3MUDSJKDysUsxCHDNATSg0=", "water": [{"s0": 0.0, "s1": 1.0, "type": "white"}], "mouth": {"on": "amazonas", "s": 0.669965}, "fill_on_pass": 1.0},
    {"id": "jurua", "kind": "passby", "class": 2, "src": "rio_amazonas", "pts": "9lCEPDgZWfzxCbEVMhIaFwMX1wg=", "water": [{"s0": 0.0, "s1": 1.0, "type": "white"}], "mouth": {"on": "amazonas", "s": 0.558728}, "fill_on_pass": 1.0},
    {"id": "japura", "kind": "passby", "class": 2, "src": "rio_amazonas", "pts": "1arvUHv67B6X8jUG", "water": [{"s0": 0.0, "s1": 1.0, "type": "white"}], "mouth": {"on": "amazonas", "s": 0.585315}, "fill_on_pass": 1.0},
    {"id": "nanay", "kind": "local", "class": 3, "src": "rio_amazonas", "pts": "GJD9MQEBNgFTATAB", "water": [{"s0": 0.0, "s1": 1.0, "type": "black"}], "mouth": {"on": "amazonas", "s": 0.34918}, "fill_on_pass": 1.0},
    {"id": "loretoyacu", "kind": "local", "class": 3, "src": "rio_amazonas", "pts": "05FuSsj/VQA=", "water": [], "mouth": {"on": "amazonas", "s": 0.427717}, "fill_on_pass": 1.0},
    {"id": "atacuari", "kind": "local", "class": 3, "src": "rio_amazonas", "pts": "H5HeSA==", "water": [], "mouth": {"on": "amazonas", "s": 0.42038}, "fill_on_pass": 1.0},
    {"id": "itaya", "kind": "local", "class": 3, "src": "rio_amazonas", "pts": "G43bLi0FoQU=", "water": [], "mouth": {"on": "amazonas", "s": 0.348846}, "fill_on_pass": 1.0},
    {"id": "samiria", "kind": "local", "class": 3, "src": "rio_amazonas", "pts": "+ofIKw==", "water": [{"s0": 0.0, "s1": 1.0, "type": "black"}], "mouth": {"on": "maranon", "s": 0.911561}, "fill_on_pass": 1.0},
    {"id": "pacaya", "kind": "local", "class": 3, "src": "rio_amazonas", "pts": "BHa+Io0MAwk=", "water": [], "mouth": {"on": "amazonas", "s": 0.30235}, "fill_on_pass": 1.0}
  ],
  "land": {"verts": "///bpff9mwNb+u0E7vwxBP/+xw3p/pUJufe+DND4hQVZ81IGsfK/Btf1xP5D+S8Ea/zsCKv++wH6/TMGpf6uAndPAAAAAJlGmQOp/HkGrfoFBJ765Az77PMQ7ff6EL34rglj/M8UVfi9CAj9LQ6S+HkEff+/HwAAXQvfAPIBIf+UGAAAogWWAsUI/wbTB9IGYQ2qBrwSHP5MBff+8gft/A==", "tris": "JwAAAAEAJwABAAIAJwACAAMAJwADAAQAJwAEAAUAJwAFAAYAJwAGAAcAJwAHAAgAJwAIAAkAJwAJAAoAJwAKAAsAJwALAAwAJwAMAA0ADQAOAA8AJwANAA8AJwAPABAAEAARABIAEAASABMAEAATABQAEAAUABUAEAAVABYAEAAWABcAEAAXABgAEAAYABkAEAAZABoAEAAaABsAEAAbABwAEAAcAB0AEAAdAB4AEAAeAB8AEAAfACAAEAAgACEAEAAhACIAEAAiACMAEAAjACQAEAAkACUAEAAlACYAEAAmACcA", "zones": [{"id": "land", "tile": "canopy", "first": 0, "count": 38}]},
  "insets": [],
  "home": {"on": "para", "s": 0.727595},
  "labels": [
    {"country": "BR", "xy": [31457, 44683]},
    {"country": "PE", "xy": [26214, 6752]},
    {"country": "CO", "xy": [46399, 17079]},
    {"country": "EC", "xy": [42729, 4766]},
    {"country": "BO", "xy": [11534, 33165]},
    {"country": "VE", "xy": [59244, 28597]},
    {"country": "GY", "xy": [60292, 43889]},
    {"country": "SR", "xy": [58195, 47860]},
    {"country": "GF", "xy": [56622, 53222]}
  ],
  "viewpoints": [
    {"id": "boca_del_amazonas", "xy": [49041, 59400], "reveal_on": 10, "fact": "map.stop.estuario.dato_01"},
    {"id": "macapa_y_la_linea_del_ecuador", "xy": [47272, 57462], "reveal_on": 10, "fact": "map.stop.macapa.dato_01"},
    {"id": "isla_de_marajo", "xy": [44620, 60408], "reveal_on": 10, "fact": "map.stop.marajo.dato_01"}
  ],
  "passing": [
    {"id": "breves", "line": "para", "s": 0.267088, "fact": null},
    {"id": "gurupa", "line": "amazonas", "s": 0.931756, "fact": null},
    {"id": "boca_del_xingu", "line": "amazonas", "s": 0.925817, "fact": null},
    {"id": "monte_alegre", "line": "amazonas", "s": 0.873037, "fact": null},
    {"id": "obidos", "line": "amazonas", "s": 0.831466, "fact": "map.stop.obidos.dato_01"},
    {"id": "parintins", "line": "amazonas", "s": 0.792603, "fact": null},
    {"id": "itacoatiara", "line": "amazonas", "s": 0.74661, "fact": null},
    {"id": "boca_del_madeira", "line": "amazonas", "s": 0.737774, "fact": null},
    {"id": "boca_del_purus", "line": "amazonas", "s": 0.669964, "fact": null},
    {"id": "coari", "line": "amazonas", "s": 0.630108, "fact": null},
    {"id": "fonte_boa", "line": "amazonas", "s": 0.550446, "fact": null},
    {"id": "santo_antonio_do_ica", "line": "amazonas", "s": 0.502694, "fact": null},
    {"id": "tabatinga", "line": "amazonas", "s": 0.442633, "fact": null},
    {"id": "caballococha", "line": "amazonas", "s": 0.423121, "fact": null},
    {"id": "pebas", "line": "amazonas", "s": 0.384389, "fact": null},
    {"id": "boca_del_napo", "line": "amazonas", "s": 0.362913, "fact": null},
    {"id": "tamshiyacu", "line": "amazonas", "s": 0.341885, "fact": null}
  ]
}
